user_id,name
142,Yard must develop money everything part.
85,Soon pattern can happy.
705,Eight everybody research organization.
698,Thank protect significant American.
776,Month perform case worry position southern.
955,See imagine force shoulder total industry.
755,Put news family phone list people sea.
585,Religious near institution move.
616,Room assume war specific.
337,Forget assume hair our.
477,Cold project ok involve drug.
327,Ago tax value change.
947,Tell heart edge generation.
613,Inside state yourself couple carry.
611,During successful stock as anything mother have.
200,Wall next safe figure sea.
883,Which federal south nature avoid cover crime.
620,Office girl rate attack natural across writer.
339,Free whole high development couple specific town.
616,Study these allow born.
116,Develop even federal run generation head.
218,Measure beat while such.
202,Here amount energy true image beat.
317,Hard let one indeed.
747,I interesting his economic follow inside know.
469,Already enough concern last.
387,Ahead today that lawyer city.
784,Enter new relationship. Box describe authority.
180,Apply election skin industry against.
657,With begin action energy.
768,Southern spend west off push mouth factor money.
6,Town later operation develop large resource.
498,Model create manage base foot.
708,Training low reflect culture space indicate.
209,Those civil edge rock. Local gas seat.
491,Often him power. Cell call protect.
326,Skill pattern through democratic.
907,Nice available watch.
984,Firm agree air some act number consumer.
51,Much because staff speak up star.
449,Hour character movement would.
13,Never very owner clear include agree now.
448,Although box research mind else piece police.
141,Yourself staff fall age respond take development.
55,Commercial sea benefit edge.
717,Prove ready attorney politics five.
785,Few cut ability five.
757,Edge blue eat.
790,Soldier wife quite treat behind right.
267,Court kid ask land thought have yet peace.
191,Number size base talk.
945,Very prevent trade contain. Share together car.
966,Mother beautiful police smile dark grow.
354,Condition material himself talk senior fire.
428,Owner same continue people.
818,Drug deep understand card what movie pattern.
871,System people sense number. Agree couple science.
600,Attention factor every head street.
423,Somebody quality clearly site station.
751,Poor if though office word machine.
698,Onto few force happy lose this star.
259,Once social popular station film recently.
877,Similar bank look poor enjoy look season seem.
580,Point alone group smile design forward.
654,Writer energy indeed like.
872,Learn anything buy fire decide newspaper.
817,Day claim poor worry surface future.
523,Son I wife treat state cost. Around hear cover.
433,What fall put property rich bar.
130,Produce arm language wrong citizen real set note.
586,Truth they or along whole report morning wonder.
516,Street term provide follow.
44,Southern because whole discover could.
751,Through head store whose.
614,Live tonight either administration beat.
32,Far wear late source consumer material.
447,Low culture individual.
131,The cultural guy TV.
486,Another subject safe. Phone point boy be general.
133,Policy standard market unit.
584,The boy professional memory heart.
110,Back agreement wonder.
388,Front week sound church source food.
888,Gun next wall director ago number.
502,Notice act although entire.
47,System a operation themselves push save.
460,Morning simply appear rock girl.
459,Individual maintain concern tonight road.
352,Citizen general guess art hospital detail study.
132,Space strategy generation include end them whole.
87,Cultural system film through per.
517,Value today woman hair themselves development.
794,Black sign customer ability.
887,Very parent good itself you learn.
53,Safe fast entire list power.
142,Garden learn simply author.
765,Lawyer whether choice voice Democrat computer.
760,Song less quality data able.
18,Risk safe wrong civil.
769,Employee role table list decide write.
581,Get science bill size.
675,Appear he dog produce not pass.
928,Happy identify lay through stop development.
109,Scientist loss late process color.
64,Condition about child relationship which whether.
117,Describe price hold success listen interest try.
876,Question lead evening give open away their.
288,Arm energy economy pressure far ground from fact.
200,Send amount particularly. Five head do my.
561,Great memory section miss federal.
313,Strong along drug state.
426,Look couple minute attorney.
937,Including type hope guy.
266,By seat structure southern.
479,Play news about who market.
664,Fly every city whom eye story different concern.
626,Wish sister star tough direction reflect town.
720,Science maybe above last prove require.
945,Expect of new strategy break protect Mr.
599,Law Mr image stay who mean able.
316,Leg baby yard investment investment only choose.
384,Writer their wind sign rather pattern story.
928,Hospital any win TV gas.
530,Past suggest sit church line bill it.
804,Begin degree seat wear author help entire.
148,Your address once standard themselves arm.
799,Wrong black section end prepare nor.
116,Describe risk history oil method.
744,Money who area score claim.
537,Door describe indicate company.
157,Speech yes suffer should least pick rate.
328,Piece challenge citizen risk bring today.
865,Live research effect address line low finish.
197,First language which deal.
627,Model reach near although feeling develop four.
327,Adult near find education.
962,Generation area central phone travel provide.
367,Might crime whose.
248,Activity at experience space.
259,Both choice people ready.
607,Team entire type far natural fish.
411,Special range service this.
295,Seek energy one government health play with.
807,Similar fact crime talk have in rather.
241,Meeting girl decision attack green.
156,Thought population clear debate operation.
655,Take dream staff determine owner.
248,Model help media laugh player stock member.
544,Tough across those by group ok argue.
273,This adult language where. Himself keep try many.
276,Western heart line sit own loss.
699,Beyond seven it play.
249,Day move few fish investment.
724,Common key write free important coach.
855,Every itself her old kind peace almost.
566,Free popular among fast peace teacher.
20,May center my general couple east represent.
902,Prevent own run writer.
672,Ten under push add Republican buy.
463,Population near receive better for far least.
936,Try big small picture sort. Know evidence local.
878,Today sure ask.
214,Point enjoy you. Our easy range.
959,Hair second morning itself.
777,Into measure up perhaps near.
606,Sometimes page hair pick necessary reveal land.
273,Him artist sometimes dark. First current writer.
442,Game family detail need run hand.
326,Find almost stand theory husband.
230,Such soldier wonder employee future.
406,Exist difficult land skill stand job.
164,Both music cup tax later. Address put and.
618,Animal likely notice.
22,Team or produce strong.
980,Worry usually gun almost challenge tough debate.
662,Investment reach quite perhaps seat.
571,They approach model rise method since challenge.
875,Sometimes name win only case include.
356,Several business off ability me most.
668,Boy down member public stuff family.
306,Analysis late unit.
591,Size talk majority investment avoid tree.
306,Food trial tax.
266,Modern or gun answer how.
338,Visit light allow impact interview vote national.
192,Toward system picture none action response.
989,Anyone difficult particularly.
142,Pattern year prove determine matter.
91,Suggest build management agent today space.
777,Project until gun before soon show.
289,As executive within western suffer.
574,Well deal life son.
244,Ago own brother visit peace such.
145,More politics any.
873,Against consider until score lead tree.
93,A ever difference light go state feeling west.
891,Including probably have what stage almost cut.
401,Carry treat because fight.
1,Detail out question serve book night.
945,Respond world sure news almost.
637,Fill worry character.
249,Laugh adult community room food southern month.
545,Think read hold six agency individual party.
573,Whatever easy long them explain pass than.
682,Reason away left sign age well.
573,Specific bank let form.
824,Avoid good piece way name couple.
844,Choose by produce one.
531,Face yard natural.
403,Instead between food special gas two guess.
359,Guy fund eat listen. Kid by strong car would.
168,Must measure board.
342,Stock than able chair heavy.
665,Red need require very.
181,Structure value three different run.
424,Rest structure term election.
188,Behavior fly even management task.
690,Note good attorney site. Set decision turn stock.
832,Somebody common material toward attack our.
571,Believe top yeah probably bar level.
420,Successful whose read never eye food scientist.
371,Employee think area age less reduce outside.
915,Ask respond recently.
474,Join morning leader work. Back hard specific.
916,Process expect art. Realize building listen.
190,Night similar stage enjoy pay past.
414,Claim director someone production learn clearly.
862,Nearly require final machine.
395,American them president source in remain pass.
818,Moment still join training because.
839,Style fish live authority paper instead.
603,Case reality last radio child.
213,Time gun upon price individual result difference.
301,Whole attorney election.
755,Include southern great.
864,Human involve be more wall.
76,Meet investment collection democratic until.
268,Suddenly leave cold notice no.
149,Herself turn avoid appear magazine marriage dog.
421,Argue share east will.
670,Best people agency use. Dinner me base.
299,Magazine room reason PM. Seek young less him.
439,Evening site government.
677,Probably society bad control though.
975,Seek know couple federal.
370,Sometimes impact civil you method manage.
449,Whom wear sense low.
171,Stuff together without call.
999,Small success style travel.
997,Marriage reality outside.
334,Condition politics firm single school.
393,Finally human current book throughout in start.
624,Him avoid yet news.
198,Daughter organization artist.
663,Green early appear pay not case to.
56,Democrat start begin.
92,Station size one throw other blue stock.
459,Allow red candidate somebody nice.
487,Huge president to act change.
504,Economy method pay recently the.
225,Day talk couple. Full father also.
264,Bill significant whole themselves.
140,Or certainly soldier fact together trade.
709,Or strong line brother young majority.
595,Forward every among authority wonder serious.
63,Herself alone cover scene.
950,So campaign four of wife they.
694,Medical life cultural choice top stand behavior.
406,Firm get heavy animal reason drive.
418,Home some various right thought enjoy stuff.
649,Knowledge wait support information.
248,Visit speak color road son.
623,Any effort long history member although.
623,Different usually sit worry pull performance.
698,Though could quickly can everybody guy scene.
890,Determine think college position at walk.
741,Mouth something election discussion.
341,Myself foot though how.
929,Send power all beat.
541,Lead next remain. Least moment those nor.
128,Front technology ground man.
312,Despite left her north relationship these also.
243,Challenge say because bad follow ground.
888,Threat crime land color service.
538,Would wide store fire.
949,Southern sometimes woman movie watch some leader.
980,Administration want before exactly light stock.
592,Full yard customer. West month let send option.
293,Likely one significant while bring.
723,End explain cause lot reality.
30,Also world hit ask claim if.
212,Total region administration purpose us we.
822,Mean west impact room view enjoy decade month.
157,Notice tell many.
244,Our central wish. World letter consumer per.
268,With contain join.
744,Test response fact community business it power.
138,Bit us similar. Whole activity last director.
67,Series my instead.
920,Reduce building yet short.
724,Blood bed inside break. Nearly cover sea song.
98,Affect its sit her note.
173,Nature prevent ability give use without.
7,Traditional PM key since return water.
650,Store network sure never consumer I.
469,Quickly common sometimes leg success important.
471,Early member early international.
716,Finally enter cover market population above.
471,He between fish.
893,Nearly describe on ever material.
237,Decide top recognize same against.
600,First recognize easy pattern.
63,Third read success specific beat.
177,Quality analysis wall.
767,Upon station raise go carry fear.
946,Like none his image suggest western nearly.
862,Politics west bed maybe chair discuss culture.
843,Watch never hope others live.
933,Rich follow suddenly.
805,Market operation ever attention should.
51,Low against language since PM.
47,Country personal eat on member in.
827,Including wrong something history.
337,Bag country rather top participant.
560,Same be it region item character probably.
789,Operation weight most stay ahead glass.
910,The get rather here their.
447,School story grow employee.
40,Perform toward father little.
68,He wide enjoy may.
418,Husband seat sister government international.
515,Yourself plant this down since Congress.
24,Research create west firm level.
978,Itself employee check near PM scene cost.
834,Yeah argue court consumer high value.
288,Student four open question.
686,Care class reduce radio actually should less.
626,Bill ever early well force city candidate.
773,Structure likely daughter everybody test happy.
650,Everybody pretty reduce like live experience.
71,Last customer line ability be itself now.
292,Remain nor similar choice suddenly.
135,Including general floor fire fact with law.
962,Choose stand pretty.
706,Evidence enough magazine road environmental.
601,Recognize arm party service record husband.
348,Environment court radio look.
120,Avoid measure low clearly teacher although thank.
789,They growth charge likely meet could knowledge.
72,Social form at produce couple.
960,Hot since relationship site.
712,Wife western economy property accept region.
722,Billion name cultural attention star hour.
202,Around computer half sister level hair fine.
190,Student mean break natural coach why.
534,Capital under goal run research year appear.
902,Instead risk each imagine science.
995,Individual focus whatever its must speak.
382,Her finally coach recent record along standard.
618,Girl line specific work once.
808,Yourself not ever bill.
213,Out lose statement leave safe generation.
157,Study east meeting dog.
160,Fill hold democratic drop defense visit.
172,Room benefit beyond factor state likely.
769,Century prevent turn newspaper range.
722,Growth score almost film gas bad agreement us.
933,Suddenly approach over.
764,So teach bed itself. Hour man number.
876,Work sometimes claim animal ask.
260,Recently close keep happen.
123,Newspaper book pay resource write friend.
483,Center couple man need could able know lose.
870,Blood character exactly sister.
914,Item back light road certainly.
112,Around report wife possible.
879,Provide ok certainly support response.
918,Bill after allow west show expect.
22,Every prepare carry much clear.
178,Stuff participant rock another issue bit.
316,After close son behind indicate care.
433,Read administration some.
187,Despite short couple future.
18,Artist back audience really wait.
479,Available president fly bit until may production.
950,Word return debate drug concern.
502,That chance deal ball.
942,Court into art trip. Bill small us society bank.
842,Make free career simple compare best.
15,Young door environment you south.
181,Take hotel company.
741,Individual attention discover.
230,Explain employee before police.
782,Especially trip decide bad majority what ten.
637,Among open development five. Let south option.
994,Last claim rich keep reach run.
727,Treatment blood serve themselves perhaps.
155,Wrong yourself imagine.
968,Ok herself property yourself.
5,Value win floor child environmental.
325,Your likely special bed offer.
164,Fear training about say. Certain risk later.
813,Election know learn push.
532,Go decade night hold instead.
807,Table anything doctor media its do name.
156,Television recently significant notice.
337,Particular hard particularly himself.
482,Without term finally matter world.
701,Million hot place address TV stand third success.
263,Step institution nothing find reflect.
780,Only mouth what reveal claim artist.
972,Later clearly eye state often office life.
268,What soldier last oil.
593,Dream necessary public push difficult.
321,Project visit medical election.
26,Save after important TV.
874,Probably behind deep success.
278,His according institution if sense fear.
736,Dream any his force usually often wrong.
749,Door easy employee Mr real defense.
715,Others moment billion sister southern major.
474,Employee expert simple fly help together stuff.
210,Blood easy just body.
875,Sometimes become perhaps some lay car.
40,Something with move two so.
983,Direction authority another.
746,Able color official.
393,Democrat travel teacher provide keep difference.
776,Beat start left education executive art though.
408,Fall difference live one another member.
835,Usually top mean writer hit.
753,Realize choice expect single write share.
166,Direction run focus experience.
242,West degree style different.
681,Anything away little reality she.
445,True whose activity accept. Break effort miss.
692,Common cold good technology.
369,Value entire determine edge imagine.
235,Light sport would drop while artist Mrs.
2,Lead people likely score.
336,Where provide movement speech close.
955,General three thing whatever hope.
645,National stand fill pass. Including too consumer.
454,Buy teach care ago worry cup.
582,Bed allow apply into.
364,Customer college significant fill.
77,Morning life data. Him science yeah off.
563,He deal black life pass conference.
500,Discover hospital recent.
277,Site door site senior.
57,Bad ever way law world term truth.
977,Crime reason international later.
104,Still want realize either husband fly direction.
467,Movement spring price argue him agree cause.
658,Organization perform material others common.
48,Democrat apply side ok let right keep entire.
658,Edge senior table memory smile art.
804,Moment use oil bring key lot five.
74,Charge enjoy phone record site.
339,Green full herself final including.
279,Health choice those long difficult former.
976,And possible station grow really camera debate.
842,It again left soldier bill site could.
951,Yes carry somebody. Key ago growth center.
960,Left college beyond a.
470,Trade garden free sound yet or.
524,Record real none hot rock drug.
713,Its current dog effort prove look religious.
579,Easy why along.
202,Realize across keep experience.
195,Difference see production huge laugh.
39,Green major why rest enough doctor new around.
364,Goal begin goal edge story final authority.
801,Least after risk so beat evening budget.
660,Receive their themselves too.
389,Quickly light director move.
739,Summer media letter store.
486,Fish suffer much even usually say.
543,Around minute force daughter despite prevent.
235,Many dog five pay news.
937,Agency national base hot despite month.
182,Bed tree end daughter doctor suggest.
793,While the grow senior budget lay support.
42,Military part the almost since issue behavior.
106,Wear drop bill product child under manage town.
372,Technology those full.
330,Theory look sister answer.
388,Have city phone whether ever.
31,Food week by rich everybody. Little share fire.
306,Same can despite any begin.
71,Center ability year everybody center prepare.
401,Agree home return school. From alone make reach.
883,Decade different meet gas eat.
971,Trial hold first together.
843,Rich ready individual health wrong wall.
215,Discuss paper modern their.
338,Hospital pattern fact. Minute own just.
716,Pick training simple last mouth after.
943,Whose already reach rise hit.
44,Occur consider us material half find.
566,End yourself court can.
349,Century growth education operation throughout.
268,Democratic wear edge much can few.
94,American wish week eat.
799,When agent which yet.
535,Staff left chance another.
671,Leader decision difference.
837,High natural pretty name fill generation.
417,Leave feel then issue same.
317,Foreign read deal memory address.
985,Affect suffer woman give her write firm.
692,Evening small race PM dog.
586,Already truth find we money although and.
597,Involve no edge piece understand financial.
748,Coach reduce later necessary economy glass.
678,Class house hard sport go agreement.
971,Fine their claim rest argue owner.
221,Foot modern color sign off training describe.
892,Whom remain term reflect much base hear.
289,Clearly success act face citizen note threat.
893,Behavior model run word.
490,Hard we with where major cause cost.
339,Avoid never risk nearly image.
400,Sell report large message wonder.
3,Method purpose a senior care moment.
689,Economy carry soon show.
438,One physical wonder family.
390,Result growth amount ok deep.
886,Seem claim up page company join.
278,Allow view citizen against.
708,Middle out southern.
704,Moment consider table down low wide beautiful.
307,Learn cause final someone campaign.
145,Also mission buy personal record save modern.
812,Figure major guess before police.
389,Third other just. Claim describe four each.
29,Sit middle somebody discussion evening like.
449,Me fly thousand position part.
208,Policy writer author fall.
781,Computer month girl.
648,Personal medical particular.
19,Nothing firm business professional smile father.
696,Wide hour town side.
6,Issue dream rock thus form realize world society.
254,Not teach option white.
753,Player every officer thousand station worry over.
810,Interview similar significant election air tax.
430,Option democratic thank up what drop opportunity.
103,Reduce shoulder contain heavy.
540,Or middle nearly nor.
491,Many level face everything natural you free.
287,Hot themselves experience performance run.
454,House house finish buy worker.
197,Son fly develop indeed.
673,Environment grow team reduce itself their would.
939,Avoid which number. Work chance that.
503,Into military well cost. Until bring member.
248,Affect head resource new.
834,Air open stay hope offer support although since.
409,Use unit than difficult put modern cultural.
688,Talk lose visit recent area.
555,Behind particularly describe guess.
162,Center answer later idea half five next arrive.
893,Usually pattern war. Method fish rule fine.
355,Certain never doctor account usually.
535,Else bar why boy network account stuff.
6,Hour quality close local. Since fly well parent.
923,Another range million scene remember.
468,Hospital able PM still senior.
426,Find much this sport dinner.
521,Improve get receive research.
327,That score factor sort they truth movement.
85,Customer pay raise manager.
704,Yeah analysis economic military building around.
541,Moment big write worker good.
570,What indeed small young choice.
183,Either size of wish.
704,Personal evening contain central ago.
41,Federal site lead.
836,North give about key.
265,Exactly course meet number.
465,Language white traditional building PM.
219,Prevent personal audience watch eye middle share.
286,Sea fire night international letter section.
158,Act local explain.
724,Ask challenge teacher TV culture raise season.
386,Blood establish certain kind.
750,And allow someone great reflect sort.
631,Likely thank charge investment song.
786,Fill four above we example large century.
568,Imagine listen reflect tax.
566,Score improve although hard worker.
948,Their left value give fill.
854,Draw continue significant.
347,Decade fish also how.
791,Citizen picture those moment gun.
728,Record first boy structure until give exist.
379,Coach pretty any word woman set reason media.
654,Join sit outside laugh.
413,Three eye value smile along adult.
117,Consider series view.
916,Quality magazine two across including.
441,Person reason only.
61,Keep child radio worker section visit think.
751,Eight peace guess knowledge.
286,Around show road.
858,Scene tonight change society.
412,Fast something answer air.
380,Ok discussion dark sure.
594,Better see fact call reveal.
473,Not bank meeting especially media act.
950,School local catch event.
319,Bill nation west green.
36,Prepare stand along just more theory.
139,No activity fish which.
383,Structure success commercial form final model.
755,Executive decade write.
120,Feeling central own general between class.
82,Receive per dark more sort.
732,Season true pick across agree view.
358,Stuff two image local social half.
23,Per interesting political service thought.
910,However performance former black media might.
97,Main bar suggest floor throw half.
208,According staff hear various reality.
405,Officer performance might foot.
387,Large stop memory peace.
415,Tv in front study analysis news.
715,Suddenly herself shake its interesting.
224,Beyond stop picture school buy campaign.
708,Soldier I although bill.
163,Three across top end. Tree hold great religious.
267,Southern box great yes hour reflect process gun.
403,Leader several news energy dark black occur fast.
929,Act here forward meet whether draw piece.
28,Top former major different young pretty itself.
408,South admit focus production.
741,Again should like region road per ability.
11,Society type drop yourself method.
333,Age trial so second growth.
825,Morning ready military feel possible staff.
216,Player senior those find.
413,Star realize third.
103,Skill have base must hour beat measure.
874,Old simply new American there whether speech.
259,Team truth issue as off assume its base.
602,Seven food year. Remain matter occur finally.
851,Store take amount thus.
172,Discover worry and coach public central.
87,Force big about prepare guy wife available.
508,Practice answer your finish. Budget reach and.
