user_id,name
861,Customer he seven board candidate save son.
955,Culture position care election blue evening stay.
519,Home firm sound shake few them last.
932,Tonight list role candidate.
204,Different employee should exactly through he.
204,Particularly present other.
877,Affect close young difficult everyone.
313,Clearly young company travel know point where.
423,Type save ok table.
379,Hand arrive clear account describe challenge at.
887,Road return area.
3,Floor unit site office huge himself.
947,Agree special along resource land collection.
766,Know type ready wish peace table whose city.
543,About around girl behavior if rate itself.
407,At stage together.
763,Personal soon high all blue cup.
385,Majority apply land government political sport.
749,Study write the shake pay his force.
883,Hundred happy according everybody which current.
387,High writer sport indicate alone walk if age.
282,Other sort meeting space structure five onto.
946,This window southern particular.
565,Before information decide indicate.
860,Relationship picture prepare when.
115,Nor name wife second.
319,Government thousand cold board article.
943,Sister alone toward end amount total.
187,Clearly your reality within prove back.
852,Magazine daughter democratic.
539,Entire Democrat paper treatment life bar happy.
473,Police serious wish any born bed attention.
324,Republican different address agree.
853,Bag hotel sister join.
193,We return ability pressure.
492,Every rest model still.
229,Scene majority sign join treatment bag whatever.
463,Brother fly yes community bill just hope.
448,Other impact deal direction if.
151,Company particularly message assume beat.
63,Media ten rest seven property could.
870,Sell case people soon TV push same guy.
394,Check rise behind her together think maintain.
413,Each education character stock political for.
537,Management much per among ahead dinner catch.
968,Hotel together bill office democratic.
936,Live itself technology.
161,Specific despite section customer these.
324,Save add head less expect practice moment value.
854,Effect some final admit.
938,Former beat American under.
726,Term blue boy must research magazine nature.
418,Range here foreign face finish pull.
55,Less reduce event nature inside forget occur.
671,Article less carry partner draw return.
212,One religious present rate yet.
367,Kid doctor in friend result alone.
143,Unit couple simply clearly rock we edge.
84,Focus assume respond with.
961,Born including say trip skin.
869,Matter may natural.
938,Charge heart site.
650,Discuss less hear center management might.
535,Drug everything six voice finally.
632,Mind few similar understand develop.
319,Boy defense new Mr something.
979,Check goal bring.
278,Answer low collection ok spend air.
987,Hour price dog place science wonder.
19,Poor among break right.
699,Firm protect movement staff believe.
482,View real gun sign seat.
419,Must cause type energy once whole rich.
971,Simple know group than example successful part.
994,Case occur international someone next tend.
121,Memory skin game.
223,Nothing follow police security.
821,Star actually civil under.
293,Occur important feel political.
921,Decade care election wait society social.
703,Country front already effort drive time.
563,Kitchen house the money yet fund box.
31,Color consumer south really.
481,Yes carry indeed past hundred.
963,Anything skill current life a senior.
563,Major station thus ok.
614,Least need eat every turn.
546,He day measure art prevent would on.
789,Each though hope building little quite.
197,Nor individual side provide theory.
777,Blue wall quality modern attack significant.
223,Mouth door court management.
647,Production rise indicate say relate front.
998,Special guy although protect decade front.
363,They business minute listen office anything.
372,Set add back service same game easy thing.
641,Free southern term down it structure need time.
956,Walk onto risk carry drug play.
339,Hand finish analysis southern own real.
222,Able produce even allow more detail tell moment.
362,Director evening gun later support machine.
104,Hear reason can dinner cell.
741,Would fire health. Tree spend house.
402,Data tend cover impact amount poor act.
146,Truth girl technology several meet during.
352,Side truth development art hot.
152,View traditional outside.
394,Sense effort a us gas material nothing.
173,Soon employee million possible magazine.
664,Them effect son friend.
471,Resource leader kitchen price close.
392,This more receive guy.
11,Recognize who attorney. Knowledge those half.
712,Floor experience girl break around describe add.
238,Moment respond subject way finally free sit.
314,Toward upon us agreement sort.
30,Like blue inside local short those.
354,Kind none explain voice.
406,Gun peace them.
338,Will artist his forward already cold.
931,Member wide wish head ago however.
45,Walk up respond still bank or perform dinner.
432,Picture under commercial decide.
397,Doctor throw agency similar sell window.
560,Mind present plan anyone kitchen.
2,Fill film sing expect animal simple.
854,Sound remain skin east financial allow.
455,Never force parent eight activity.
576,Feeling chair across.
161,Human trouble design economy site.
943,Summer special class.
85,Market region security alone in Democrat method.
580,Age visit well memory whom away maybe.
585,Still it ability save sometimes step.
74,List choose could or operation expect.
463,Reach whatever identify green fact.
607,When in mouth continue listen especially join.
179,Section I speak peace capital necessary daughter.
68,Major certainly food industry challenge.
657,Own Mr fact media this professor.
565,Remain partner inside southern visit happy or.
135,Beautiful education suggest eight.
205,Although agree water well this south there.
642,Goal full sound manager series.
514,Thank control century ready.
230,Good focus enjoy lot fund.
472,Movement movie discover American stay.
68,Card capital outside under like material.
979,Senior seem section simply design thus money.
187,Movement night field position red.
552,Third cup military half become effort process.
855,Interview politics feeling.
397,Bill hospital TV set game power.
8,Yard perhaps college. Plan type hundred.
806,Catch civil particular drive.
48,Eye successful consider future.
772,Machine big sense send.
880,Single could high election program ahead.
800,Want ball forward.
109,Religious study tough the letter sure go.
810,Ability tend reflect husband sometimes pass.
127,Article perform organization difficult would.
698,Concern break theory. Tend wear indeed compare.
771,National season difference. Inside staff ago.
451,Store never arrive once perhaps break.
145,Response growth choose alone station easy.
425,Hold take pattern grow make.
67,Reflect position week out force.
286,Likely fish friend play exactly hand either.
545,Compare minute occur. Individual pretty same.
147,Family hope job help herself check game.
393,List sense camera lead central wait far exactly.
444,Describe camera game reach ball.
610,Team institution find lay.
791,Including culture forward view possible war.
833,Require budget international the.
44,Whose return mother effort.
899,Investment when whether rise model that.
137,Good thousand direction baby possible.
297,Back collection others activity up coach.
455,More recognize particularly protect.
948,Able throw firm.
816,Wall visit born away however.
19,Factor event certain group capital.
799,Candidate sit grow certainly military.
796,Include cup on employee pull.
173,Continue worry claim will.
573,Offer that thing share.
51,End new fall. Record edge car.
410,Law leader sport spend study result.
451,About interview force list worker.
40,Wait when young system case rest.
56,Stuff show although big report.
274,Chance share which same prepare animal.
343,Value wait recent million trade spend.
744,Person beautiful feel population.
542,Probably note energy tend happen even.
564,Rock soldier company wait.
544,Entire ten woman. Store anyone still.
793,Future own over last.
504,Its performance head give.
985,Not rate let drive.
884,Particularly size later role hold.
129,Reflect relate professor population become blue.
489,Tend nation marriage yes sit high different.
283,Fight voice season career.
900,Contain instead try out issue discuss.
127,Edge figure hand small green.
397,Job hour phone land tree.
951,Song forget successful office record.
136,Between hear one.
447,Phone buy international do.
529,For throughout cultural nature middle.
191,Fear allow dark series.
270,Join fire herself exist name ok sort.
711,Loss side particular discussion civil lawyer.
289,Board course future strong father level.
756,Father smile key staff time society color.
731,Eat even page whether me system recently.
996,Analysis although simply heart.
386,Skill section carry physical body who he.
74,Reach movie memory. Almost suddenly step.
829,Say walk customer.
400,Service strategy term financial.
320,Relationship total security structure.
416,Site goal physical whose join deal smile.
709,Measure because rate it generation president.
206,Outside medical fear total lot major.
44,Base buy sport cover movie.
623,Could sort hold their.
398,Rate crime whether account major.
922,Weight thousand officer region truth contain.
373,Sell few garden.
318,Blood check important I plant.
896,Lawyer read character detail ball agree.
800,Fine form benefit thousand.
121,Democratic whole call staff wind senior.
287,Crime growth exist fire usually former.
509,Instead interest shoulder audience.
208,Offer large old kitchen can.
344,Ready dinner activity loss.
697,Cause ten religious like bar foreign.
114,Sister address better sing project.
292,Republican focus speech wish idea artist.
722,Expect manage matter type.
131,Partner item relate open than.
564,Skin manager generation oil American.
29,Senior pick again nothing.
89,Executive however home anyone ask top close.
4,Student assume owner than evidence should.
933,We common throughout. Sell phone morning.
673,Hand treatment then imagine purpose account end.
787,Front our to prove response possible watch.
794,Win receive speech offer occur may catch.
612,Respond suddenly usually both arm be camera.
123,Rest research develop call player.
533,Attorney Congress store result.
669,Discuss why cold voice ask campaign.
542,Several almost number list.
73,International ahead rock right final.
775,Final your spend answer job.
889,Worry simply morning tonight billion system girl.
501,But including budget financial.
295,Many go itself plant thus learn back.
420,May parent note season coach Mr certain.
946,Ability reflect PM medical as throw instead.
884,Hold charge hotel board share everybody piece.
474,Cause feel wide.
397,Candidate little prevent among trade factor.
424,Hard choice gas reality parent.
548,Since behavior these push network certainly.
23,Change man class reveal mind government.
102,Party unit their. Of box beat.
940,Former discover Congress. Time security stand.
352,Marriage develop leader sit sell.
261,While down cell others.
578,Dog child prove road she.
394,Fall music argue indicate hundred summer local.
291,High system officer.
108,Together nation social participant out happen.
709,What attention reveal approach moment.
820,Street company tell something.
961,Hospital director also four.
296,Include talk deal effect amount approach.
260,Value much lawyer daughter prevent blood.
439,Between political type business fall.
174,Quite factor sing rest.
894,Type late feeling shoulder make listen.
566,Group begin room cultural assume student various.
470,Why executive country laugh. Start again notice.
105,Person suddenly child argue simply board fine.
403,Stop travel serve. Can rule surface.
579,Strong toward but writer chair.
677,Quality memory wife almost.
607,Set though have he shoulder.
594,Group personal may where maybe.
652,And walk anything week level window.
157,Look page low network.
693,Food cut fact. Add true enough.
648,Write so yeah need religious.
503,That boy laugh time travel.
556,Realize important type bag.
716,Article finish purpose.
869,Our far weight agreement because cold detail.
694,Everyone song consumer capital onto fund.
83,Picture instead allow.
299,Own participant least evening side into box.
319,Stuff off crime present movement child happy.
811,Industry everyone rise style that base reason.
477,School get argue act.
517,Almost computer only head sense.
718,Tough everyone admit.
611,Reflect glass institution. Vote along yard just.
716,Ever public street public investment make.
839,Image represent worry hundred garden really.
157,Phone political range kitchen contain financial.
45,Southern event job.
67,Seem finish message southern.
569,Recent race cause whole character.
930,Choose project school enter.
810,Project lead face both huge.
664,Score leg would tree teach Democrat.
428,Ground wall state maybe sure activity rise.
86,Wear next next pretty themselves surface since.
182,Step day old civil.
28,However world least president.
2,Amount past ability bed common check about.
294,Set ago drop open lawyer.
285,Form current how letter environmental clear.
190,Thought center important institution project.
931,Form Congress stuff usually matter agent.
105,Budget consumer per seem enjoy remain.
54,Military information dinner week child.
592,National wind information still section suffer.
58,Short pretty society situation nearly.
637,Baby consider decide.
776,Here religious while per.
335,Night guess operation day child second.
558,Start performance similar general national.
142,Citizen film former draw Democrat join.
865,Sea sometimes force. Yeah success book any.
746,Cover bed manage adult.
680,Also seek value situation.
576,Force grow large along watch throughout.
331,Music economic mother.
70,My by present state boy of she.
499,Blood exactly modern nation outside author law.
221,Movie show brother behavior cultural hundred.
166,Because way way.
727,Pick discover serve different camera.
368,Since worker those leg.
517,Part his cut deal prevent several so glass.
659,Again social spend hot anything do.
68,Eight news value. It including hit deal show.
741,Under whatever career group bit keep.
62,Above trouble case them.
934,Reach different become operation realize.
73,Send air receive get until role let.
872,Leave view audience source so road.
956,Me baby career several that language.
648,Trouble or occur field there.
999,Whom serious herself story feel time.
550,May listen teacher student.
117,Wife able local remember assume.
611,Science listen interesting bag interview set.
267,The final material exactly hear tonight.
614,When ten or.
473,Mission measure test state. Enjoy she staff.
933,Responsibility side perhaps modern drug.
512,Expert seat mean mention fire kind.
905,Despite choose hold position she rule wall.
748,Role huge however sound teach cover.
263,Rather old pull now.
891,Risk kitchen another.
391,Sound car me community picture.
749,Explain receive professional score hit role.
226,Rise visit significant none.
265,Industry against nor both believe.
800,Human agreement court crime fly nature.
540,No civil person industry because feel.
249,All answer customer heavy miss together meet.
251,Third friend Mr age serious own.
780,Mr official market quite.
926,Local American white south future.
137,Decision table project tough ago outside return.
217,War of use single else sport reduce huge.
485,Back pattern because focus laugh fact family.
735,Power exactly family with toward detail gas.
800,Stay beat few through. He should second.
864,Building because bank war camera strong.
662,War tonight meeting say security effect itself.
829,Just trouble fear expect race wear claim.
151,Seat heart read become.
947,After police big interview meet.
862,Social house foreign hot.
241,Loss radio size environment.
950,Stay I financial total necessary.
76,Sign reflect kind chair.
981,Movie offer ever start commercial certainly.
296,Executive provide drug difference.
672,Nature money if however your figure.
865,Piece owner ready person short value before.
865,Three indicate box she realize.
380,Thought also suggest government fast more.
201,Whose try foreign happen I.
763,Public gas raise claim wear democratic culture.
30,Yourself my law like senior worker.
154,Feeling kitchen agreement represent agency catch.
341,Whole never return direction.
451,Pretty ground citizen economic deep.
41,Weight leg vote future treat.
49,Bag play dog describe bag catch.
981,Pattern wall either often population good.
700,Peace trouble change after service half.
792,Across property lot food.
373,A for less very actually consider good affect.
281,Expect main rate team sing.
122,Care entire drug.
16,Power particular production teach wide.
542,New event executive water.
156,Chair cultural note stay ground computer green.
725,Season call manager rule.
401,Painting onto maybe admit yard character.
521,Role the meeting and.
209,Ever beat modern care despite.
640,Indicate a operation full reveal while high.
897,Probably company cold will others.
272,More from senior health.
746,Feel situation rich reach feel of.
148,Question out affect degree budget.
357,Ago off various discussion north decision upon.
976,Side care simply save want ago rather.
588,Single across if range program have owner.
474,Analysis oil rest thus medical catch science.
975,Fire several around pay sometimes this.
989,Rock you crime miss size computer news.
422,Opportunity or Democrat.
70,Edge nor bar. Positive direction tough.
439,Operation ever which after.
369,Until program mouth. Minute gun score.
637,Yet responsibility create position top.
505,Couple second use car. Claim couple land.
531,Agree against report stuff program wall talk.
192,Small certain car sell check.
167,Against within newspaper win north middle.
406,Again all you mission.
178,Maybe second ground guess ahead describe.
639,Specific peace less begin take military standard.
19,Off dream here. Happy meet station man.
467,Lay poor consumer star maintain team participant.
212,Decision course reveal section remain.
499,Fill none middle.
567,Now against they care. Hot nice walk choice wear.
26,Book can dark majority fire modern quality after.
913,Expert half successful thousand standard.
603,Deal source painting.
9,Bad establish your seem.
843,Coach similar improve. Place meet blood woman.
911,Left through poor local.
190,Action although skin high history form.
76,Among exactly next within similar share.
784,It size kid compare to.
992,Several fact look.
966,Card across compare could science house.
957,Kitchen beyond several just hotel.
646,Have get whose for wife.
298,Clearly quality policy field task painting.
322,Factor individual area really it.
826,Same your push year college.
174,Sort either me race.
62,Pass available hit writer great speak customer.
480,Professor rise ability tend rate least so.
217,Pattern tough among ask.
792,Fill management face set have during themselves.
862,Finish hundred decade authority wrong.
468,Be into live learn number.
245,Attack way trial involve use appear without.
364,Account bag make think.
100,Value find moment. Speech will western exist lay.
768,Citizen though here.
1000,Star size list quality beautiful tend story.
55,Itself letter heart worker.
902,Power discuss whom real culture wait young.
597,Could discuss authority structure.
394,Stock kitchen state matter treatment play.
450,Cut involve vote she property.
338,Save again more through from follow.
217,East for fact full report stage field any.
441,Learn mission or mind evidence nature.
59,Level TV TV these.
521,Think large reality maybe.
742,College them charge herself sometimes budget.
73,Student write child new throughout however step.
330,Focus follow art fine. Personal bill hope hard.
53,Reach media technology them.
859,Two war black wrong actually job writer.
96,Morning environmental most suggest woman paper.
175,Apply her kid street world low.
634,Although picture suddenly time past simple.
903,Change keep war however concern else.
475,Economy young produce mouth product cost free.
730,Paper among ability feeling employee.
849,Fly attention move tree.
159,None east agent.
441,Account stay social thousand.
527,Keep body measure exactly. Argue everyone piece.
26,Join today bad understand. May rich never above.
611,Or note paper most more for leg.
316,Two less anyone difficult read bar trade central.
697,Much become natural official play end blue.
889,Cell break author call research direction Mrs.
841,Majority she box mission. Third available bank.
109,Film good rest single.
2,Third night too true.
146,Decision record project.
689,From then billion. High little like analysis.
34,Recently quite black.
618,Mr actually effort statement decide side protect.
535,Above hotel over most sport model describe.
507,Paper those interview you admit ball.
676,Bad bed health campaign piece provide cost.
708,Social bag particularly husband enough compare.
872,Wide detail class.
379,Drive value per wall high.
391,Within eye statement data.
262,Grow interest interest peace person tough enter.
214,Clearly air within camera.
907,Candidate under onto enough under out.
351,Total trial skin health explain.
811,Alone she first weight second.
258,Us control song store across.
940,Five seem even do.
60,Try degree baby news.
860,Behind law fill. National new appear fill.
83,Authority college specific send.
597,Somebody ball range us year.
821,Challenge ground sure in next so.
578,Include themselves chair speak.
476,Light upon imagine.
783,Risk know class return image.
777,Pay time least over evening minute just through.
77,Rise another tree management church. Paper PM in.
168,Your Congress study pretty none.
961,Growth buy country current run.
37,Lot book ability trial remain.
817,Culture away fine member try yet understand.
113,Sometimes house must hope with fine.
767,Our strong recently above stage.
618,American sound one deal world.
137,American account own spend section.
237,Clearly the firm election foreign drop hear.
427,Management although much.
261,Wear by create produce your resource interesting.
697,Control side speech for government on artist.
974,Event tax catch.
247,Suffer bar move pull. Six into draw court writer.
261,None article assume audience performance soon.
684,Test vote view deal later now.
141,Future individual fine theory upon speak store.
791,Imagine middle ball result memory husband give.
702,Present source street entire development.
248,Away space necessary movement.
130,Carry reflect night good cause concern anyone.
396,Girl reach expect always.
992,Series source industry say.
859,Issue chance suffer old.
463,How past list you Mr less maybe step.
87,Guy near air kind beyond. Edge cold family.
495,Investment stop allow. Minute training watch.
945,Example build there suddenly sure way.
508,Painting consider success rest at dark assume.
623,Right throughout tree down white.
148,Drive international least. Pm watch gun.
967,Tell although capital rise student.
203,Determine explain approach reveal pull race fact.
139,Question cover eye statement tell local light.
176,Civil year society lot determine song claim.
27,She free simple still hand establish.
809,Which Congress name. Local also staff.
884,Important there so who school position.
525,Class financial often work her couple.
909,Community season night across. Side work think.
399,Leg process first mother indicate laugh.
346,Available power too number network.
840,His future body particular money.
478,See maybe company difference over.
720,Middle one property they.
315,Enough where entire.
517,Wrong could even then good.
588,Soon front right rate.
993,Protect simply build future lot item dinner.
870,On attention time guess pay should.
251,There seven all risk form. Pull often visit.
193,Effect which hand friend mind exactly.
258,Summer factor eight when enter sometimes parent.
388,Role ahead yourself must that.
882,Image produce modern natural dream.
223,Fight fire run she expert.
100,Fast bed face firm per word live.
44,Company high increase write gun couple president.
958,Inside seven just system very family pretty.
928,Way as man store culture actually.
186,Get service draw enough check author.
777,Ever itself five. Think medical happy cold.
513,Him near piece own.
951,Big space plan because people daughter trip.
528,Staff attention record never attention.
819,Knowledge through discussion foreign test.
633,Appear pass grow page these more know.
699,Believe serve page yet.
345,True evening a with including.
326,Treat section short approach shake little name.
46,Already help begin follow lead.
817,Green break take degree key drop.
119,Scientist range identify year.
480,Enjoy account feeling rich movement.
846,Film hotel American save blood tell respond.
343,Individual hear strategy very.
321,Unit he site.
131,Ahead positive large peace movement agency.
852,Like determine have year apply program.
111,Authority despite catch director young.
32,Energy American treat prevent both play.
733,Pattern power size assume although.
204,Century eye son wait.
823,Everybody fact exist either amount usually.
666,Relate quite whether new memory.
576,Artist recent to recently standard product.
173,Author friend any operation meeting of.
558,Because senior partner either consider his.
995,Charge majority finally talk factor behavior.
514,Society without social consumer suggest.
942,Choose most week firm suffer stay professional.
490,Check cell senior just. Reveal into seek.
123,Short her list sing break.
194,Election clear impact message operation.
711,Let I occur evidence nature force raise.
929,Water resource role mention.
474,Computer protect world able out.
853,Born work Republican manager relationship tree.
458,Forget minute box easy discover kitchen deep.
994,Take which argue politics deep rise.
997,Official writer if answer.
782,Must well yourself.
580,Least office still last pattern throw tonight.
