user_id,name
241,Truth every name husband.
34,Religious social particular seek.
927,Throw response training well stop far.
921,Purpose test why majority.
569,Concern several blue around.
198,Area financial art.
438,Activity nature poor various herself.
385,Eye positive amount take whole model any.
377,Law wide process single pull data these.
506,Across prepare analysis itself because.
358,Laugh he top situation film carry direction meet.
10,Represent three success raise chair apply affect.
437,Call one sometimes why adult.
712,Foot allow rock budget hair.
577,Enter argue others thing.
576,Theory enter imagine system past they situation.
848,Mr structure from television.
395,Class market TV method yes fact memory decide.
235,One particular sell water.
563,Then actually green though college.
894,Industry address score wait anyone course.
631,Put lose color difference couple hour.
788,Goal then letter. Strategy safe fall institution.
614,Officer anyone option themselves land black.
44,Us detail state section.
739,Natural concern unit conference happen rate.
755,Hair loss operation night meet cut say.
568,Bad remember then thus PM produce whom.
581,Off figure institution rich organization.
733,Continue history year nor similar both.
13,Pull this discuss.
894,Perhaps need vote military word.
8,Drug organization design box safe wife.
826,Give chair degree into.
223,Now reach soon with.
382,Federal contain bad career mean.
570,Boy author that south material item instead.
523,Before around might spend. Probably than role.
943,Better open compare law.
99,Mind after national attention increase serve.
510,Plan here response suddenly.
85,Indeed cover could guy.
251,Kid study name service age. Public bank everyone.
936,Cut already outside arm high mother.
880,Drive not bar actually reach then.
482,Here general food certain arrive.
372,Apply today standard write.
483,Work full real want action. Mind seem policy let.
509,Evidence far local cell.
486,Manager that forget power poor business.
532,Security worry race stand different interesting.
624,Wife deep try there although must.
87,Prepare some drop bit wear decision.
382,Seem affect its within.
180,Give tend meeting attention decade.
42,Cup leave water among pick available small whole.
583,Wall base north everything lot.
822,Sport ago force cold. Return least data.
997,Health born deal heart opportunity various.
996,Boy though southern owner dark down.
859,As ground peace focus push.
471,Over to federal sit. Skill usually you he.
628,No region man use company.
717,Develop hair group life he best.
796,Fear want away blood pass record.
233,Any foot rock offer.
775,Kind left number learn. Us son return model.
633,Per involve spend.
926,Her best treatment hard daughter answer Mrs.
793,Scientist best interview foreign.
916,Line all although four week show state.
537,Home rest senior both social.
397,Relationship point that behavior.
56,Drop policy happy no notice itself popular.
549,Good sing late hear force.
722,Maybe much worker pay.
766,Ask well great sense.
344,Who my agency him pull simply issue change.
530,At mention capital onto myself.
681,Possible maintain big partner.
713,North strong yes eat by ball. Expert to rather.
603,Local approach step system skill stock.
726,Girl also them speech beat.
373,War stay evidence thus right message.
791,Owner event statement PM economy.
870,Exist idea tree animal dinner price help.
450,Foot last without only.
180,Technology toward skin trouble.
776,Because environmental agreement.
688,Far race management agent foot.
724,Career beat alone every moment.
40,Process those pattern try scientist word nice.
939,My hand tree low.
359,Board near expert protect team general.
765,Most tell oil probably amount peace.
864,Glass month rest two.
185,Month tree Democrat he side education body.
446,Every little check deep structure.
778,Could share factor first fast forget subject.
926,Among size rest your father model animal.
160,Series painting modern feel soldier station.
948,Image finish strategy order scene expert.
357,Author hand stay staff.
902,Pressure second pick idea people.
785,Doctor effect deal.
224,Name sea management change like fish great.
435,People center western.
878,Physical ten decade husband discover character.
546,Public cultural issue they.
610,Give force thought traditional us your.
850,Happy value work.
448,Role do happy capital pick rule study.
669,Production claim really region rest.
296,Lose future serious detail.
466,Mind buy party enjoy good.
465,Exist although religious then put.
401,Focus thus heavy hotel suddenly.
89,Call big window serious consumer far.
437,Film thank learn training style.
22,Main drug wrong.
462,House item there source certainly.
632,Ten while treatment second.
374,Fish business site long. Oil people attorney.
518,Answer need design white production.
771,Now research deep huge.
214,Road young whole risk ready those vote.
631,Official with food cause two law.
582,Her list building commercial.
844,Brother social world hotel travel.
182,Upon side drug traditional decide also.
669,Hospital spring wear official hand miss catch.
121,Establish season scene alone garden city each.
644,Much decide yard could. Response look ask man.
524,Put author American check sit organization.
818,Long ten truth next. Raise still house candidate.
480,Note customer language. Produce event quite type.
647,Home tend sort fine service within store.
661,Child increase character later sing man better.
755,Also environmental live kitchen position.
63,Military news market career situation.
817,Of now suddenly oil dinner relationship reveal.
980,Skill color marriage police bit of available.
479,Black store card fact take fire recent.
385,Might piece leader until tax to throughout.
369,Fund always account painting have technology.
270,Reduce fly seat moment strong prevent find.
797,Face oil beautiful Republican position.
713,Claim help bring leg.
377,Then party green seek line computer.
565,Idea painting can certainly.
112,He result describe everybody blue worker station.
3,Bag feel but so ago usually throughout find.
870,Maybe hope artist debate worry least her.
98,Trip admit more least old ten school.
362,Likely sort wind change.
458,Company class affect sure in way artist.
774,Foreign subject than fine consider.
289,Kitchen idea investment.
560,Method ability full case notice.
650,Our center job each when key.
874,Hit during rather stay yes part.
951,Home not class condition large style deep.
204,Building business TV better box listen language.
128,Bad against develop spend.
679,Republican evidence happy structure again record.
869,Wall source citizen place letter.
232,Bar worker improve court either television.
39,Fund friend require party reduce.
354,Cup check for control which collection.
418,Finish effect ready camera.
885,Perhaps first here exactly.
167,Central provide can outside.
446,Worker skin detail continue.
461,Find power approach industry.
284,Eat hand standard difficult focus senior only.
729,Conference include class future score.
242,Follow couple tend hair method part.
732,Election bill beat low lot not kitchen.
31,Pay stage tell upon water.
435,Girl Republican let should finish page personal.
605,Support west begin benefit arm also great up.
567,If suggest wide wrong. Guy use west.
295,Himself entire view audience family alone no.
571,Trouble treatment right major wall.
267,Perhaps no support structure stand.
981,Trade majority expect establish.
835,Join choice check throughout.
948,Material fine wish land term dream.
524,Important thought ever part once suddenly.
618,Cause dream name reflect.
345,Note collection live hotel.
248,Themselves collection start wide.
673,List dark note hour.
597,Plan plan something might safe might your.
392,Seat minute sing exist fine live boy arrive.
927,Along possible house space spend next consider.
358,Organization wait teacher from some strong.
282,Friend actually game.
105,Type wonder woman your type business itself.
746,Necessary me various increase.
407,Treat woman score culture do store drop.
74,Effect drug art expect. Time join subject.
750,Win whom street though weight number challenge.
731,There better senior.
734,Stand idea fly control laugh.
254,Short teach benefit other.
900,Degree address head reflect beat.
206,Value night boy.
490,Want free service close same security.
8,Too quite community guess day edge.
409,Save happen most company.
587,Main often policy.
634,Per garden could early store account.
677,City southern article draw.
249,Stand buy tend money figure far.
125,Model have strong evidence sense maybe whom.
175,Old together million culture may.
519,Artist whatever close prevent.
511,Plan appear like enter night.
578,Grow including none all assume.
24,Meet too true he source.
310,Network wall nice quite turn yourself pull.
632,Analysis old as bad the result.
584,Response us land leader establish name.
477,Indeed network ahead suffer.
523,Reveal charge quality imagine capital step.
665,Assume produce region as herself of fact.
314,Spring cup imagine service truth.
570,Radio oil alone worker place.
456,Country church property mean yourself indeed.
870,Forget father story best.
342,Marriage contain imagine report.
616,Machine night common.
307,Benefit travel manage present benefit happy.
124,Body prove eight ground.
514,Should hundred president such.
311,We marriage consumer full cover blood down.
927,Government woman teacher space like.
350,Customer time professor camera.
958,Like close almost across pick.
238,Just million couple call deal together move.
630,From try peace particularly day cause.
936,Compare court tonight wall stay coach.
630,Instead crime color mean can floor.
628,Hold resource daughter range hand program.
916,Now country body gas civil gas.
124,Scientist here bit response.
541,Standard coach improve know ago trade national.
788,Several owner admit defense former exist.
911,Bit shoulder animal morning.
984,This house still growth. White lose able.
518,Space chance really art.
66,Media same money large they staff probably.
722,Push available ten may.
694,Dark world decade would our mention guess.
398,Central find style wife.
469,Official nature season.
188,Fire left audience.
288,Daughter allow ready yes.
422,Class book forward then southern check.
308,Who sing culture water special thing.
12,Five nothing now health apply he west.
847,View relate body director.
239,High create fight control central stay buy.
538,Her short see care knowledge usually.
498,Who time leg some stay.
136,Glass force ball be raise few.
938,Defense skill place join north ahead.
575,Treatment whether business mind.
386,Discover baby sometimes general.
943,Pick act put notice real.
413,World deal protect start her buy none.
694,Seem by member fly successful stay voice.
653,Always religious individual foreign middle one.
230,Himself senior difference lead.
976,Wait computer technology social sell off.
272,Already that understand.
396,Yes ago hair do be story.
78,Rise prove it mind. Rate have campaign fund.
197,Always win couple civil old picture.
587,Need sign star thousand support support to.
65,Lawyer glass see include support into.
750,Drug who spring ready yeah top always write.
277,List middle executive recognize.
989,Himself friend claim north board amount.
231,Event face focus small.
631,Myself finally analysis dream employee.
416,While operation if like.
729,Door stuff conference bill full artist back.
831,Pass foreign admit.
294,Republican bill attack idea thus theory.
77,Wide TV understand under push source.
395,Despite financial both.
801,Feeling action still share item run.
743,Reflect couple she base.
926,Condition enjoy truth material.
837,Should trade test while cup number.
305,Hard finish style difference far book discussion.
86,Skill wonder plan challenge light.
396,Something suffer main case fear.
34,Also account probably bring mention free speech.
366,Serve nothing account finish religious.
643,Such week reveal human remember. Own edge behind.
391,Worker often itself wait begin.
705,Up drop else specific impact.
133,Young key skin thousand.
405,Beyond it enjoy though car maintain.
526,Water tonight decade measure pass behind page.
282,Art need official attention expert.
232,Eight store fine write first.
312,Effect record fine sell might guy.
695,Begin stuff level catch hard low most.
7,Meeting sea upon attention as sister tend treat.
827,Quite morning sit.
549,Away bank why could upon hope wish.
593,Every with central collection.
601,Space article effect drive black.
152,Medical no determine.
859,Church me issue debate.
637,Few glass game deep. Note attack law.
241,Positive article style research sure ask well.
294,Theory worker finish everybody evidence.
285,Social strategy yard each.
317,Yard oil rock even first election father.
582,We determine for field will power store part.
582,Point later her season.
695,Central recognize radio.
724,However either base work choice student detail.
445,Past article dream produce us financial job.
694,But popular team team too.
788,Increase she south hotel green act.
567,Manage seek describe school material.
653,Off know attack where possible focus.
333,Professional car perform real.
225,Improve animal animal have see trouble.
355,Here old democratic.
301,Others meet agreement throughout candidate.
345,Across many later tend thousand large.
123,It different sea painting whose.
84,Star movie pass black.
7,Movement house not these teach deal.
71,Box Mr actually catch.
868,Could any product woman.
758,Exactly price all film guess book.
812,Either where without challenge fine.
863,Say manage between happy either career.
603,Strong first fund appear.
251,Blue story medical environmental.
377,Half later imagine already peace.
255,Pick address worry along music.
404,A fund catch enjoy need.
970,Financial series when table.
213,Song ever director north.
734,Bit seven major page. Even reduce hundred.
959,Protect end policy blood town probably become.
844,Agree type big meeting meet story.
352,Both contain success agree discover.
882,Decade stage his half nearly effort.
232,Wife box perhaps identify score enjoy.
567,Draw evening back say.
732,Relate go young finally.
241,Fly including itself out school try end.
91,Doctor civil think up.
939,Space she with seek skill.
292,Guess less toward open argue.
570,Former occur among various continue baby.
492,Our region court quite south management.
867,Away simple new sort thank.
549,Organization activity art drive old green.
148,How discussion how physical office.
378,Issue work push source seek now.
542,Rate answer million form.
499,Cover eye have not kind.
447,Cultural involve economy myself camera.
172,Add store throughout growth.
842,Poor question high cell method start unit.
796,Body finish little data build.
339,Activity reveal discover raise grow prove off.
62,House cover then sort water.
217,Training send according their gun expect over.
861,Nice economic west image per.
281,Expect window behind side day pick.
102,Perhaps really positive story picture such.
824,Gas yard hundred describe.
221,Country week check.
372,Country here pay husband.
102,Manager study clear traditional.
624,Difficult itself give.
111,Amount into option front.
795,Available record arrive sister contain stand.
935,International gas election board cultural open.
516,Let across and.
834,War nation next worry personal second purpose.
674,Get marriage a bank produce way.
36,Night great couple produce head.
852,Agent company method toward home.
704,Enter sing process yourself remain beyond.
573,Only receive evening toward.
853,Start college either professional.
913,Future this make act. So whole feeling design.
598,Enjoy unit most.
560,Try recognize modern live.
988,Hear scene base system. Condition young over.
897,Notice and yeah specific growth event on produce.
933,Everything better visit little above drive star.
904,Act maybe president third film wish.
595,Feeling Congress article key.
285,Example air glass air and.
731,Sign various home. Rock standard evening former.
611,Seat exist Mrs drive material.
230,Generation lose Congress decide.
913,Room government close keep family people.
801,Economy career offer. Kind might natural.
738,Case benefit up together gun cause buy.
155,Me beat three four various whose quickly section.
895,Herself major play relate suffer truth nature.
712,Which arm amount crime.
875,Look find true focus career watch image.
232,Of stand time seem.
620,Fish government red share which production loss.
5,Spring past say live. This view or affect nor.
976,Trip into court.
169,Enough score likely everybody.
307,Should five ask scientist change as music.
826,Sister option responsibility.
742,Voice data name wide piece.
232,Imagine face hour family no.
797,Method anything nothing radio newspaper.
857,Sell customer where. All movie effect street.
905,Trade thus food fear minute catch.
834,Bill window occur ground natural see hard.
912,Its establish loss necessary make Congress fall.
521,Drive order agency. Fact east bed goal win build.
982,Help difference material later space.
982,About party anything result growth.
398,Throw choose resource on.
893,Across actually certain notice cover huge dark.
27,Performance decide yeah.
354,Yourself today professional trial these.
93,Report amount teach myself.
140,Wall listen set modern amount other.
797,Standard yes religious.
758,Newspaper reality need wind.
244,Hot amount its election picture.
926,Sing house garden yet fly collection TV heart.
393,Attention meet note claim probably.
240,Final realize foreign decade certain.
822,Perhaps thousand total able political ability.
95,Inside ask move walk executive describe.
489,Message child response represent.
888,Respond beat newspaper account enter form.
211,In gun sense. Eat data still wide.
619,Population possible recognize full.
75,Left author return sometimes prove same.
344,Activity choice human entire school new student.
657,Mr improve my politics.
972,Call though ever continue.
941,End try spring argue. Never dark already pay.
788,Memory may affect pretty into type.
466,Eye guy newspaper marriage girl.
538,Age most field Mr what cause after.
380,Drive under lay world degree.
972,Stage field second method material.
108,Despite lot you us analysis office.
355,Though his owner speech specific hear impact.
112,Like particularly their attention.
52,The deep parent nation radio beyond.
608,Expect stand threat as.
776,As nearly partner shoulder ten music.
366,Score happen happy help.
610,Adult with heart sing.
106,Change plan field drop thing.
325,Represent job call off take live.
220,Be through break answer big.
252,Nor deal couple while.
990,Floor plan too. Strong nor daughter.
348,Ready change sign experience either.
245,Brother sense whatever full wind area.
921,Talk financial compare society item able.
339,Manage information arm meeting wide room.
997,Produce lay teach society interest or type place.
320,Group economic food national center employee.
381,Just yet tax main character.
693,Set sometimes my race church provide.
667,Good against understand at whatever.
911,Hour visit trial somebody place quality.
538,Manage personal best hotel financial through.
257,Coach by town oil travel. Into between will.
449,Sort this form fact.
588,Forward allow myself claim follow ball true.
663,None everybody mind during early method speech.
909,Kid author land situation total.
992,Too green air.
812,Across affect rock provide.
765,Focus such day.
265,Include social whole join however movement.
171,Market civil strong ball quite offer computer.
80,Body security spring.
646,Something ever billion remember.
546,Page sport sure ok purpose.
394,Step model put TV us song which.
492,Source blue rule reduce his.
974,Hope item style report class.
670,Thus red when available executive if.
975,Yes part year. Whatever minute term account.
779,Example indeed speak method detail.
727,Customer democratic down whole develop of.
442,Development include detail beyond receive.
666,Our majority knowledge think at most player.
841,Discuss enter seat performance while chance.
981,None deal why. Per training by audience.
161,Land manager admit set yes.
151,Certainly artist professor fast.
569,Theory determine ago from.
973,Family both five local certain.
796,Cell political reveal fight way.
248,Page view section else worry.
56,Out thing firm major participant might nearly.
571,Total child face its whom team our.
81,Account degree fish pass.
80,Itself use expect industry matter health.
204,Art seek choice once end approach fill.
612,Today order what instead.
974,Close growth claim standard close style east.
927,Crime store imagine adult step put.
390,I claim pay travel.
844,Probably key create treat.
991,Feeling situation prepare brother nothing.
257,Authority natural factor.
277,On miss create piece him national.
769,Voice participant everything hotel language.
743,House court pick particular.
4,Book debate decision election say.
903,Thought stage general exactly hard coach grow.
180,End agree either candidate quality case.
59,Window face same.
836,Upon stock brother alone few.
916,Word wind situation heavy court.
519,Surface computer drop sort international admit.
806,Network suddenly throw.
760,Individual box like follow think Mr.
357,Bill executive lead myself ball notice.
696,Idea state if something music today.
345,Stuff system image example.
489,Seven beyond treat future team.
145,Item oil suffer region win that.
491,Forward perhaps your.
132,Necessary will new almost simply.
669,Myself important anything quite.
592,Now best event anything state.
716,Card adult your Congress no board prepare thank.
872,Same lead hospital indeed discover sit point.
800,Sort entire prevent watch.
108,Dinner white ahead response.
639,Life almost each new win bar wear form.
350,Ten international every nature ahead.
179,Heart stuff issue would.
77,Company occur try series easy.
133,Then fly to hold reason machine most.
813,Behind wear either human her.
896,Century pull successful.
300,Rise meet arm week.
919,Save game performance policy.
100,Technology agree son which find such include.
929,Money act nation.
836,Account seek employee or bank yes.
867,Along loss meeting around.
346,This leg concern become low example.
125,On measure product early.
74,She they effort evening money sport.
963,Movement thousand task get.
835,Per nearly father avoid doctor.
544,Every expert enter present may per.
520,Environment day against social miss science.
643,Painting grow body commercial old word red.
463,Wide allow election group above boy evening.
289,Rich financial federal skill beyond rock capital.
920,Church behind black many.
379,American son whole.
192,Against name just red floor person.
854,Movie simple dream month radio my you.
756,Above try light involve. Maintain win build.
976,Per style model your office unit full.
527,Develop type set fast history.
403,Dark government art federal down.
736,Federal pick town not land show institution.
836,Discover federal policy husband.
954,Reach star capital yeah answer.
314,Memory social seven create school travel about.
856,Respond people country check fast find.
277,North grow effect police baby accept.
557,Help or you which bar.
901,Range professional chair PM stock seat ok sing.
375,Until marriage letter cost purpose.
60,Her live lay marriage material exactly.
936,Effort federal especially.
982,Young way own help inside visit fact officer.
337,Bad soon agree probably father still military.
723,Pattern tax challenge.
495,Issue level wide message.
427,Memory and big meeting method tell forward.
902,Make head value. Audience structure kind turn.
851,Current choose if.
851,Often dinner glass all still ok compare south.
319,By former rise it center hear art.
98,Dinner improve assume. Prepare network short add.
661,Newspaper officer many score stay.
272,Deep pressure pay senior. Me hair road.
51,Sound will page hit commercial respond guy.
662,What oil back fish.
199,Dog city audience few edge throw.
641,Within whatever push same sell on wind.
197,Could section low number then reach year.
71,Both memory bank no partner surface.
168,Pull beyond western either trip.
884,Great per from major end. Woman too condition.
899,There resource both cup perform.
378,Point make current contain run head you memory.
837,Thing sit TV could per pick.
888,Dog major family treat when.
631,Enjoy save event development child.
478,Garden get mother on team.
315,Travel agent these understand religious somebody.
837,Customer member our big though loss season.
355,Fine piece each hospital four.
55,Matter address style allow list.
56,Capital forget effort.
75,Night field form ahead claim us approach.
454,Reveal better mouth debate talk boy bit point.
243,Too hear among foreign laugh anything.
726,High senior tell agency.
162,None person former remember.
316,Medical pick dark few.
400,Pick best game animal. Thousand center writer.
945,Such such list they teach together visit.
538,Other concern rule indeed senior law.
919,Task watch quickly born can.
347,Green best official relate part themselves occur.
526,Wrong live best American care follow personal.
515,Tv catch begin soon reflect. Mr meet gun friend.
742,Hot out identify no above.
815,Against current effort well provide.
966,Sport trial stop turn marriage.
84,Sea particularly agency itself we late.
574,Majority sound fact night suffer image sing.
357,Develop race above tree.
763,Apply six bit society. Site save them prevent.
849,Finish scientist art campaign fire.
729,Great method this value town somebody art.
334,Bad behind give dream must.
721,Surface prove tend open it arm.
274,Suffer leader over whatever direction particular.
431,Thank compare sing economy maintain yourself.
263,Energy behind situation by.
876,Party care responsibility section exactly anyone.
432,See pattern entire authority.
481,Subject finally apply town believe your.
663,On chance among boy research.
