user_id,name
199,Ability write hot mission message data front.
108,Go cost court smile at movement her.
841,Test life trade. Film they explain person.
175,Use machine series boy those final read.
935,But either TV blood yeah somebody north.
984,Local reach around serve country.
180,Seven fill often fight near.
509,Station become buy personal top listen send.
668,Indicate generation prove themselves.
580,Agree firm key hospital. Throw form wear.
167,Whatever book he thus want thing left.
540,By tough visit improve fly stop yourself task.
704,There you unit them.
537,Brother light street task media black sport.
247,Voice like home not through wind American.
730,Whatever plan nice game behind artist.
459,Cup lead blue green allow.
953,Agreement age all finally sell.
762,Political outside couple spring popular.
226,As environmental its single.
244,Practice same gas either story such.
314,Pattern customer thought stage.
972,Main yard can. Action me fast image teacher born.
436,Left floor statement whom around stage your.
798,Age old market law. Air tell experience.
102,Painting why check police happen gas.
915,Condition gas exactly its else far piece.
66,Choice spring large eat large.
656,He wife find give.
24,Weight international statement century help.
992,Agent special religious since pretty.
637,Adult wrong hundred throughout.
418,News late ask base. Center how senior ask.
139,Spring bit production Democrat include idea Mr.
367,Continue center eight capital score financial.
830,Discuss cell prove trip this agency drive.
277,Country beat under.
99,Necessary surface safe guess easy.
899,Unit body only join. At front hot center imagine.
889,Case new up.
608,Discover future decision crime probably nice.
497,Heavy become I lot star.
19,Think rise general something admit drop.
906,Listen trip free house require police think.
154,Check build form region camera plant it.
215,Party lawyer spend position maintain.
518,Create sure individual try remember.
20,Thank late enter rock.
273,Carry beyond relate section.
959,Art fall offer civil various.
450,Make full us table.
611,Education buy laugh himself while bed hot.
245,Teacher ready here toward.
165,Cut sure before effect reduce believe.
315,Nature five team life bad purpose.
536,People increase beyond.
225,Into try make miss feel beautiful something.
344,Financial loss brother better half.
274,Great never difficult.
133,Red nation build different success run half.
436,Quality energy defense certainly.
729,Away hand building free federal.
595,Such generation follow action future.
766,Page hear provide accept later pay.
796,Customer work could.
995,Large prove material candidate help science car.
731,Appear middle simple people.
777,Reveal quickly trade Republican nation deep turn.
757,List image appear contain.
536,Determine course these admit down.
744,Shoulder mean standard upon.
165,Start process yet wife.
93,Where sometimes care I special bring term.
421,For sure life great capital center not.
10,Water economic my you away interview.
988,Degree writer despite deep building.
834,Message organization among individual sign.
198,Citizen situation inside serious develop.
44,Something money air laugh owner leave where.
176,Culture people rather of.
52,Chance yard change lead enough.
547,Ball lead loss hand without at. Cup put forward.
666,Born society any series.
818,Edge upon include girl.
720,Month every hold process sing central.
181,Newspaper process side exist trade it.
263,Health beyond table home executive.
550,Church do majority where agent. Country be sing.
408,Reality business perform card discussion medical.
177,West house week sister TV.
620,Really fall crime close speak body stuff.
131,Ability challenge catch thousand.
235,Tax stuff person physical move.
310,Amount help she series.
703,Move explain you serve always door kitchen.
15,Step task keep.
316,Glass series natural base weight thing per.
190,Mission poor likely.
622,Computer step that audience either gas response.
285,Pull too picture degree child.
379,Already difficult true cell.
517,Husband fish performance agency speech left.
671,Her represent which nor any.
497,Expert source project decision artist reason.
982,Drive time not early. Rate stay college.
504,True she fire little.
426,Push you business wide whatever walk my raise.
374,Include company agree.
563,Yet soldier feel should chance sell.
175,Six wide possible trade.
502,Religious whether dog government option if.
900,Chair still avoid both program.
628,Share social buy affect high language reduce.
251,Analysis approach late hear.
525,Wait rate she foot hear.
222,Drive success ready write lose.
620,Where home body realize food.
837,Above deal service better.
902,Office office agree.
776,New fill artist size.
43,Off blue century season to.
478,Sing artist few. Hard question foot everyone.
868,Identify commercial news stock available list.
62,Able senior foot step report.
691,Step game game become scene.
814,Sea move her measure third.
917,Wife I under front wife claim.
706,Type later minute institution huge.
637,Risk must nor paper phone. Old land south lead.
590,Cultural off eight we Mr expect family bad.
382,Budget building man.
944,News executive small growth what time at.
514,Safe customer get decade individual whose.
893,Admit hear spend radio soldier media cold.
239,By attack say general. Rule happy usually agree.
859,Mr decide room inside seat quality.
243,Administration you record.
370,Imagine message kind.
646,Follow window skill.
435,Treat spend kid shoulder newspaper thus find.
352,Street piece deal language no onto.
647,Produce thank full show.
414,Worry return save.
221,Relate throughout account.
59,Particularly protect cut cut.
810,Threat happen cultural finish activity time.
620,Watch near agency.
712,Free lot admit myself commercial first across.
993,Speech when across down too decision about.
932,Some else Mrs travel perhaps.
284,Question avoid production most his.
980,Appear technology energy law investment.
367,Theory nearly show eye four season vote.
313,Child participant cut I.
779,Break let enough know season.
577,Likely blue space. Enjoy either gas miss.
971,Such finally threat someone inside bar tax.
611,Across per opportunity base what safe.
656,Any accept smile again top special.
578,Heart big young attention soldier avoid call.
432,North concern deal Mr wife data also.
78,Wonder compare past.
42,Most help skin weight debate.
333,Political lot chair guy.
697,Fine TV body leader reason front market.
639,Far use several listen newspaper.
459,Professor north whole treatment doctor artist.
4,Stock cup place PM sure road break without.
29,Structure not base door this.
287,Next heart trip one capital.
798,Matter kid success old season fish item.
4,Necessary board realize rock police ok.
125,Drive rule without democratic.
885,Wonder long tonight few southern.
176,Able style dream.
676,Available north author quite finally see.
444,Pick against various.
214,The way anyone summer go southern.
170,Contain anyone walk often reach.
782,Community fact design would.
46,Base seat remember heavy item deal major.
727,Less edge course exist.
239,Church citizen free campaign guy action.
499,Indicate represent perhaps measure clear capital.
373,Hot piece perform such.
708,Possible behavior able building become skin.
341,Great picture hand.
84,Remain ahead end head large specific.
818,There third week catch adult decade.
414,Street stock first law.
380,Dog cold recent thank feeling system moment.
179,Sure contain present use machine wall discover.
977,Fly nor yes.
466,As kid people successful.
234,Fine story say issue of far crime.
443,Skill represent answer of night.
595,Role leader particular old cause resource film.
593,Medical and reality cup.
679,Full necessary several start federal.
230,Ahead help job task unit majority stop.
50,Beat become ten course.
387,Late friend government than century sea outside.
215,Capital seat nature over. Me eye the ten even.
570,Reduce cause safe argue recently important.
126,Statement film any teach quite work any.
412,Just wide deep economy check order provide.
250,Close local reflect former like include degree.
584,Executive position road without board father.
87,Administration we cut rich show send.
347,Forward real play about small again culture.
647,Long reduce suffer.
967,Television away those down.
828,Rule notice key between.
560,Artist war general add glass feeling.
780,Seek together glass simply.
168,Ready ahead PM teach give control.
321,Because do well air they two world.
712,Answer wonder opportunity a. Whose soon memory.
582,White television discover how.
48,Job which modern else. Lay speech girl cultural.
34,Majority soon war ask budget tonight.
963,Why bag side design week way more.
472,Relate campaign admit box change.
294,Community hear physical range.
556,Work democratic issue ground entire.
736,Act nice since enough. Number three mention note.
754,Him young nor. Wide his just politics area whole.
579,Memory ever part sell.
158,Blue we institution crime itself news husband.
567,Ago quickly power close scientist certain method.
872,Congress her white financial same seat.
461,Learn walk table public.
445,But tree front.
899,Easy summer owner sport hold chair price.
761,Food research animal make theory movie very.
526,Similar can understand weight claim.
92,They reflect either wide. Seek a hold.
907,Fly around history same send team peace.
973,Item citizen sister or other.
627,Feeling body center professor see.
520,Home different computer level.
664,Toward then answer responsibility each success.
944,Cause inside bad perhaps.
290,Senior just my instead.
803,Fast yes always choice man. Include study ok.
215,Itself call somebody threat.
404,Own three fill every kind evidence blood.
502,Staff apply yet technology right inside us us.
797,After follow certain skill.
31,Despite total magazine late than.
98,Member room process single.
501,Weight government hold station.
338,Never national stop financial.
180,City century near. Maintain week authority major.
442,Congress note couple make. Food follow dog news.
725,Lot which land everybody themselves.
833,Exist better evidence.
808,President others near make effort.
539,Walk type world and can lawyer particular.
832,Necessary where if cup recognize.
228,Such attention wear.
735,Control before camera my.
172,Relate agreement himself nothing back parent.
627,Lay Republican work board down leader.
620,Skin cell might hand material.
750,Job station meet easy music read.
472,Congress billion certainly future too.
688,Represent her likely.
170,Hit thousand both.
771,Church reality put say fish.
99,Ago senior certainly local affect.
819,Western run such question charge value.
882,Foreign movement glass.
264,Discussion thus for quite at.
992,Someone official quality box hold.
665,Body reflect change speech if well no.
80,Field blood national catch.
125,Manager available sister beautiful.
752,Court care lose.
343,What could money capital.
415,Capital here course space statement imagine Mr.
622,Activity wrong similar concern.
35,Author argue back risk debate.
395,Both hospital heart thus player rich particular.
358,Race rather hear finally blue.
876,Region traditional detail low better.
52,College present Democrat so.
185,Sense because recently miss two.
287,Indicate among hospital wife get you certainly.
986,Financial technology wall chair.
723,Result owner rule why large green.
664,Certainly speech read rest purpose a.
793,Young note worry.
503,Plant strategy first authority total money.
90,Employee consumer beyond tax story evening four.
345,Able term sometimes government I affect.
674,Under officer stand.
260,Line break play general sure recognize.
135,Later range risk fast.
94,Room allow year thought population far deal make.
862,Analysis wrong local.
104,Executive TV various speech conference late.
686,Power job note heart recognize usually any film.
959,Food area far event.
253,Agency toward professor wear writer week bring.
616,Among you total memory.
348,Staff media sometimes smile home as.
69,Vote particular same toward break pretty.
641,List down green can pick picture need.
957,Statement receive system environmental.
875,Couple sing trial author woman.
184,Short upon near officer five value.
900,Million society study head second.
466,Be tonight community line foot people.
358,Meet old eat.
687,If she parent TV.
825,Democrat glass reason thought. Cold measure born.
442,Food nature south defense miss debate clear.
432,Minute scientist buy gas agreement.
793,Large laugh realize toward when.
234,These career himself. Pattern tough he.
279,View maybe such plant yeah development sell.
152,Third west thought movement guess.
597,Large feeling house weight hear letter assume.
876,Set event middle system whatever modern still.
327,Stage throw father theory.
191,Center must early home site style.
325,Thousand large success laugh training.
153,Painting let outside purpose inside might room.
206,Raise from treat they.
57,Expect eat lawyer position small hair.
439,Serve black while back seem help go.
25,Speech dark nothing.
485,According employee the discuss anything about.
870,Successful break degree arrive receive southern.
158,Everyone range receive her. Record claim sea.
521,Easy direction indeed decision happy.
246,Listen knowledge west benefit itself Mrs.
147,White right reason each member method.
757,Theory interesting two top tend else single.
804,Likely soldier night billion clearly.
811,Your street somebody although response.
407,President analysis me system.
152,System speak ever industry.
251,Fly decade late expert blue suffer.
721,Place soldier kid green.
649,Whatever suffer power word.
663,Defense out four want majority.
400,Should toward guy message blue defense.
590,Listen system of player religious.
434,Soon positive modern voice senior use.
216,Stuff my help commercial. Small cause court next.
385,Drive study join production important.
243,Stock statement herself air.
800,Information include chance easy action thus kid.
757,Seek indeed series since protect consumer.
651,Able miss other total.
741,Simple court turn physical away.
995,Prepare college order. Leg protect throughout.
448,Government against leave note body no meet.
635,Seek throughout nothing young.
976,Door keep admit population throughout ago enough.
456,Site chance draw natural political security.
456,Wall reveal why price dinner.
893,Congress draw laugh house budget and power city.
666,Fall authority she.
76,Challenge party movie. Student less affect none.
487,Visit final life course reveal tell machine.
395,Often consider laugh player which.
801,Close safe bag nice cup minute none.
318,Few animal almost draw because point treat cost.
335,Weight think system your.
578,Team into none point speak.
777,Under score assume stay challenge.
737,While message exactly its with.
374,Case she pretty term major.
652,Study like make still anything tree.
124,Security a place college.
545,Loss candidate investment.
588,Full real view industry already popular.
741,Community long hot wear indicate in people agree.
131,Not move compare specific past.
652,His force very. Institution own pick dream.
499,Recently get everything heavy surface.
300,Side yet upon determine form.
962,Would others increase never third play change.
337,Congress good not.
230,Fast agent security message send crime many.
860,Stay career foreign raise each everybody.
354,Local score interview media sport.
180,Debate cost without animal animal.
662,Dream second even career example.
914,Draw measure writer style throw laugh.
454,Citizen customer ago yes break.
759,Room forget bag near. Minute him should bring.
601,Newspaper campaign media toward effort star name.
446,Bank moment many season picture national job.
708,Body my hear civil thousand point.
254,Plan interview money kid.
279,Though serve sell effect summer against exactly.
851,Discuss movie event require it.
320,Idea rate pass property art building may new.
434,Enter standard day win discussion.
328,Next run notice focus hope mean ability.
23,Give man protect school personal candidate TV.
604,Learn heart attention federal voice.
171,Before style politics.
623,Doctor discover democratic.
608,Nor which too account.
115,Play involve range rich direction door.
504,Expect play successful before least book these.
501,Couple week bag serve.
827,Simply floor would and be.
293,Population red science.
310,Recognize nor government. Appear six fight too.
789,If early prepare structure.
378,Team certain because.
912,Should bit paper.
293,But time where mouth beyond.
365,Line unit institution education behavior.
523,Bring table big. Turn drive entire.
999,Step opportunity six they.
354,Think avoid apply knowledge occur although whom.
761,Exactly office third alone.
851,Perform these huge. Sort business whose everyone.
436,Bring short page business way why.
857,Race nor student any appear fund.
887,Early loss out today young already attack.
207,Dog color determine time current quality.
961,Responsibility piece quite.
59,Suffer themselves someone bit concern collection.
582,Professor between cup coach.
773,Meet report drive finish.
540,Themselves assume garden.
69,Tonight season college computer allow start tax.
941,Dark but ago what everybody fly.
565,Buy send entire data.
903,Military car worry wait board.
700,Almost politics democratic fill million better.
318,Window customer today cost people man.
94,People tree box purpose. If move rate wait and.
107,Join majority south teach way production it.
92,Decade soon everything.
277,Possible guy activity attorney.
922,Hospital argue begin their large.
97,Company next game age tree the eye spring.
102,But easy allow style father camera friend.
517,Well kitchen pass animal.
172,Chair charge only might bill Mrs.
48,True line box.
6,Language charge race film citizen have hair.
56,Property human worker. Heart growth two.
688,Television court form eye. Protect marriage do.
828,Trouble view court would according.
24,Office subject event two grow yes.
359,Sort manager tend score entire responsibility.
570,Event newspaper hour health arm reduce knowledge.
733,Build miss sister.
69,Total ago research identify those.
41,Production develop who camera inside value bank.
980,Read arrive pull Republican would.
75,Technology lead stock different read happy.
72,Situation treatment our of take owner news.
972,Coach class successful. Entire factor per.
250,Present before enter new sea only well try.
325,Office control piece serious design chair.
82,End available spend dark statement record green.
371,Clearly house central end.
231,Upon onto single public.
916,Enjoy adult back perhaps watch charge.
864,City their improve yes impact.
15,Cover name agent see.
969,Wall old thank decision charge.
215,More ten effect ahead score keep.
728,Without field out push artist something left.
546,Since describe small society young policy.
111,Style happy development lay per much.
180,Church someone large base.
125,Any discuss record energy difference.
311,Describe fire president. Side care run growth.
188,Partner law or control partner draw structure.
300,Hold necessary not history dinner.
145,Policy expect summer join parent.
798,Not generation understand party.
720,Certain boy worker stock police.
581,Past be allow item power make.
927,From to wife half. Left accept space his.
271,Movement else study next rock develop.
380,Word throw loss policy sister response.
870,Must lead particular let not.
353,Simply media tonight specific.
914,Old these training military.
708,Phone board character night.
58,Reality name course.
543,None interesting marriage write.
564,Necessary remain box approach.
982,Study guess customer thank travel.
802,Just near woman develop all.
633,Site charge kid certain campaign several sound.
410,Reflect family kid network to drop.
552,Federal until value care stage run.
882,Cell team they.
592,Two mind kitchen admit rule born.
393,Already a main cup.
727,Impact reduce determine within.
741,Ahead chair lead every report important.
427,Home raise lose parent general PM.
581,Decision create city discuss staff.
861,Message foreign hit surface.
639,For product sing level.
209,Its son building read.
3,Forward heavy parent per.
500,Reality his national third through.
21,Theory avoid down.
90,Good city moment better.
143,Successful huge should ground dinner.
655,Important wall head worry.
961,Figure wear wide civil option happen.
553,Paper argue take feel reason song.
415,Station style baby no clear wish pressure peace.
150,Company college easy decision issue activity.
858,Analysis store free station try might.
652,Book foreign concern indeed fund change.
548,Serve new fact field tend standard alone.
24,Successful long despite manager cultural.
485,Something former century defense.
435,A least break.
282,Feel ago majority page according news allow.
978,Science performance professor call.
733,Worry identify treat morning.
694,Yet woman sort discuss light benefit line.
514,Medical international up discuss.
515,Agent make some own most.
163,Left serve call back case small option.
789,Clear mind right PM so skill.
173,Discussion machine approach himself want.
796,Kitchen other light already with.
558,Section project during.
282,Policy information experience hospital.
851,Leader no note six specific election finally.
532,Us thousand strong network law response here.
128,Star city those center let while.
516,Window son none drive might lead station public.
980,Home fill floor capital enough drive.
534,Level common industry claim.
102,Traditional place song them sort American.
553,Rather study capital among.
985,Necessary often strategy full.
521,Reflect practice who toward.
985,Win investment direction land difficult.
641,Decision appear movement side money.
187,Street each new.
935,Him program both star.
723,Itself receive now his buy. Really computer live.
828,Either bank benefit take low want.
420,Answer break industry.
33,So throw easy position purpose leave image.
456,Leg public more main skill lose.
521,Work evening certain social east.
340,Pass quickly laugh next population far rate per.
773,Growth rich car house no consider effect.
142,Forget become traditional same.
932,Woman success whom and black rich.
817,Drive nation concern into reveal.
83,Tell black stop industry.
42,Resource trial response main.
212,Summer may wall meeting. Together would discuss.
87,Conference charge article.
362,Agency pattern size owner half.
730,Quality service color ok lawyer capital.
775,Determine boy stop economy find.
486,Pull establish any alone doctor.
251,Begin leader indeed night give.
804,Agreement participant ever far performance.
980,Watch follow call popular tell raise season.
916,Value affect less remember describe like.
656,Rock provide audience unit charge economy.
424,Road better property meet.
493,Body message arrive real admit.
179,Member than difficult charge. Each feel power.
661,Everybody about about ever world report them.
580,For school population eye. Could company perform.
330,Trouble they long rule.
370,Our professor identify resource.
930,Turn adult research begin college word course.
418,Center today majority training summer.
576,Voice stay almost guess rise democratic service.
405,Bad value pay one campaign whole.
848,Drop space instead eat.
440,Against safe sort raise career suggest.
962,This born arrive certain.
408,Free call identify middle.
713,Training keep commercial into they.
44,For animal receive next stage.
925,National compare goal within talk.
638,Very may effort common section whole.
504,Teacher new fill nature.
463,Of start compare pretty ball recent.
925,Eye story customer side with reach.
442,Mother significant which actually.
441,Quite chair hold social bag.
629,Thus over explain have.
862,Produce let dog else.
394,Center travel long development paper first by.
414,No central nation turn learn ok issue.
147,Sort machine town black myself play carry.
333,Others military show really.
49,Open green thousand specific rest.
269,Increase technology TV speech these.
472,Project challenge seem sell whatever.
207,Expert show eye law evidence.
712,War company six popular enter.
299,Either month security high factor.
583,Serve wish spring store four sport.
173,Measure true lawyer together.
778,About view activity after require.
682,Vote huge gas.
672,Under old society music station store when.
544,Trial nature not heavy leader catch.
656,See religious Mrs within never.
502,Traditional hospital show week here pattern.
373,Among history pattern fish.
622,Hospital happy green. Election song cause.
634,Show represent quality conference.
524,He strong course serve.
21,Fight find conference around.
409,Executive husband cut figure small clearly.
897,Wear benefit enough religious thought man.
174,Find however least grow.
401,Why candidate town weight involve dog first.
150,City ball painting identify. Like course sing.
166,Certain wait its professor seem statement she.
129,Realize morning wide couple serious car director.
856,Tell play class eight financial response unit ok.
371,Perhaps girl agency turn quality scene.
191,Seven no bad large.
282,Front report before if carry build why.
222,Together especially some energy action.
902,Risk action once sometimes debate memory someone.
319,Inside great house west ever.
812,Difficult system run herself.
461,Follow line child able age. Reach by area finish.
506,Here take that factor good write.
290,Admit general size such special.
121,Threat TV impact tonight effort young game.
603,Over whatever list card arm.
357,Party finally through but generation put woman.
777,Method few save condition.
879,Live life open two soldier different network.
277,Address buy condition none happen letter kitchen.
379,Understand its draw scene top tree do.
90,Share ten who stand box ok attention property.
236,Management nor air sit.
262,Current talk billion interest.
116,Analysis two scientist trade more shake.
